{"cameraTimelinePath":"cinematic/camera-timelines.json","cameraTimelineSha256":"bb81f64f79c7ca68079bd4e762f7b308d8f363dd910426cc1625b4afa4516256","geometrySha256":"636b31e826fdfb29813ef86a616ec1943703717bc4f9cc225eb716679e4a552a","media":[],"packId":"wp_c94d61b8bd53a3928ccd539370565169bd94d5f962c3bb4d3e21c1b81c032fb0","quality":"core","routeId":"6496900063","schemaVersion":1,"selectedMoments":[],"worldId":"ucluelet-coastal"}
