{"cameraTimelinePath":"cinematic/camera-timelines.json","cameraTimelineSha256":"e5b4de8f055d8b02c3e9bbab19e2d8f5ae64bc9d210ab7dc7d1306234f38f6e7","geometrySha256":"636b31e826fdfb29813ef86a616ec1943703717bc4f9cc225eb716679e4a552a","media":[],"packId":"wp_b1bfebd08222ec878f781bb6e1eeac7b021ce91b5e7efcc274cea5f0be7c191e","quality":"core","routeId":"6496900063","schemaVersion":1,"selectedMoments":[],"worldId":"ucluelet-coastal"}
