{"cameraTimelinePath":"cinematic/camera-timelines.json","cameraTimelineSha256":"b027e22cb155043a21919e406390dec752546ab7987c436802cd71a40737d47d","geometrySha256":"31944206abc1f0a4404e505dccd9c52a05548f8aeece839d5e9eeb6215463485","media":[],"packId":"wp_3e7977146528fdd13d0cf898dfe10fa1b2206b3252be67a4f46f8f5729f8faa1","quality":"core","routeId":"17665674778","schemaVersion":1,"selectedMoments":[],"worldId":"tokyo-urban"}
