{"cameraTimelinePath":"cinematic/camera-timelines.json","cameraTimelineSha256":"b027e22cb155043a21919e406390dec752546ab7987c436802cd71a40737d47d","geometrySha256":"31944206abc1f0a4404e505dccd9c52a05548f8aeece839d5e9eeb6215463485","media":[],"packId":"wp_3a23cbaa71d49c450d8f1b079f888a225d206656bea9641656991f74a59d0f3b","quality":"core","routeId":"17665674778","schemaVersion":1,"selectedMoments":[],"worldId":"tokyo-urban"}
