{"cameraTimelinePath":"cinematic/camera-timelines.json","cameraTimelineSha256":"385418d37a2387b6e5319616a291f3fa220efc220d3f04ab9781d9ca57b0dd03","geometrySha256":"1ad23a24a8f276248fea21172b5d24b06de8d90549cd23fdda5618011ecce61d","media":[],"packId":"wp_0ee6506545fbbc9b890c3a79098afa2332ca2819660468d3f7f9316bfd00a059","quality":"core","routeId":"15573295095","schemaVersion":1,"selectedMoments":[],"worldId":"banff-mountain"}
