{"cameraTimelinePath":"cinematic/camera-timelines.json","cameraTimelineSha256":"b027e22cb155043a21919e406390dec752546ab7987c436802cd71a40737d47d","geometrySha256":"31944206abc1f0a4404e505dccd9c52a05548f8aeece839d5e9eeb6215463485","media":[],"packId":"wp_d14982d9c6ea7014abe3b0ebfe9d6dfe0afebe66eb7c70a796790a5471740a85","quality":"core","routeId":"17665674778","schemaVersion":1,"selectedMoments":[],"worldId":"tokyo-urban"}
