{"cameraTimelinePath":"cinematic/camera-timelines.json","cameraTimelineSha256":"385418d37a2387b6e5319616a291f3fa220efc220d3f04ab9781d9ca57b0dd03","geometrySha256":"1ad23a24a8f276248fea21172b5d24b06de8d90549cd23fdda5618011ecce61d","media":[],"packId":"wp_a29b4d97d6f2363bfff8e1a226bee9f5bd480527a85540de2c04b1d8ba3657c7","quality":"core","routeId":"15573295095","schemaVersion":1,"selectedMoments":[],"worldId":"banff-mountain"}
