{"cameraTimelinePath":"cinematic/camera-timelines.json","cameraTimelineSha256":"bb81f64f79c7ca68079bd4e762f7b308d8f363dd910426cc1625b4afa4516256","geometrySha256":"a8df0a6efc7db7a167d21947a5939360e1dca4438829e112bc667cd6eb1ae94a","media":[],"packId":"wp_8d2aecf919be08af72e63ce849d4210a32bda1785fa5e83da3dc03efb066513f","quality":"core","routeId":"6496900063","schemaVersion":1,"selectedMoments":[],"worldId":"ucluelet-coastal"}
