{"cameraTimelinePath":"cinematic/camera-timelines.json","cameraTimelineSha256":"bb81f64f79c7ca68079bd4e762f7b308d8f363dd910426cc1625b4afa4516256","geometrySha256":"a8df0a6efc7db7a167d21947a5939360e1dca4438829e112bc667cd6eb1ae94a","media":[],"packId":"wp_69410732b128dbe730c57f16cd186c3015e4d920597e35a4a088e42fb7493bef","quality":"core","routeId":"6496900063","schemaVersion":1,"selectedMoments":[],"worldId":"ucluelet-coastal"}
