{"cameraTimelinePath":"cinematic/camera-timelines.json","cameraTimelineSha256":"bb81f64f79c7ca68079bd4e762f7b308d8f363dd910426cc1625b4afa4516256","geometrySha256":"636b31e826fdfb29813ef86a616ec1943703717bc4f9cc225eb716679e4a552a","media":[],"packId":"wp_465bc298bd0f525d2b73430b12b978e92cef9ae71d40b2c38ceb85d01117f326","quality":"core","routeId":"6496900063","schemaVersion":1,"selectedMoments":[],"worldId":"ucluelet-coastal"}
