{"cameraTimelinePath":"cinematic/camera-timelines.json","cameraTimelineSha256":"385418d37a2387b6e5319616a291f3fa220efc220d3f04ab9781d9ca57b0dd03","geometrySha256":"c8d4758e3b31a3976c83be79033f0e55dd4a7af4064acad2a44ae569e0fab74b","media":[],"packId":"wp_30c64b0cbd257315c466ffa546dbafe65781bac9c0f3fff66e9e45dfdaba3151","quality":"core","routeId":"15573295095","schemaVersion":1,"selectedMoments":[],"worldId":"banff-mountain"}
