{"cameraTimelinePath":"cinematic/camera-timelines.json","cameraTimelineSha256":"fc3bfc751e5e214d59001ea36809b5f15986d09689ac5f55e1930afa2f6f5a2c","geometrySha256":"636b31e826fdfb29813ef86a616ec1943703717bc4f9cc225eb716679e4a552a","media":[],"packId":"wp_c26dca2c4573447722b90223b037cda5681ea248605765bbbe588353bb41b90c","quality":"core","routeId":"6496900063","schemaVersion":1,"selectedMoments":[],"worldId":"ucluelet-coastal"}
