{"cameraTimelinePath":"cinematic/camera-timelines.json","cameraTimelineSha256":"23ebef4b0e6af3b0339a42d23318decc0c7bfa2bcec39983ced8fa4dec3fd7d8","geometrySha256":"31944206abc1f0a4404e505dccd9c52a05548f8aeece839d5e9eeb6215463485","media":[],"packId":"wp_553ad1d779cb13cf0d1e6d0dc85f2b8cdf17f37963aa58edef9acbcd4f3dc306","quality":"core","routeId":"17665674778","schemaVersion":1,"selectedMoments":[],"worldId":"tokyo-urban"}
