{"cameraTimelinePath":"cinematic/camera-timelines.json","cameraTimelineSha256":"385418d37a2387b6e5319616a291f3fa220efc220d3f04ab9781d9ca57b0dd03","geometrySha256":"c8d4758e3b31a3976c83be79033f0e55dd4a7af4064acad2a44ae569e0fab74b","media":[],"packId":"wp_2c02563ef8f3674ca08b88141e493290fcea12a80dea07678f6bd39fe24cf2b1","quality":"core","routeId":"15573295095","schemaVersion":1,"selectedMoments":[],"worldId":"banff-mountain"}
