{"cameraTimelinePath":"cinematic/camera-timelines.json","cameraTimelineSha256":"e5b4de8f055d8b02c3e9bbab19e2d8f5ae64bc9d210ab7dc7d1306234f38f6e7","geometrySha256":"636b31e826fdfb29813ef86a616ec1943703717bc4f9cc225eb716679e4a552a","media":[],"packId":"wp_4815261602b01da51ca56651ed886fadf7fcf989c8ab6485469515417b8d1eac","quality":"core","routeId":"6496900063","schemaVersion":1,"selectedMoments":[],"worldId":"ucluelet-coastal"}
