{"cameraTimelinePath":"cinematic/camera-timelines.json","cameraTimelineSha256":"2f56e93811b4b8a77be0f9dbd5d86917483c625bc01289b656c286a37a3ab991","geometrySha256":"c8d4758e3b31a3976c83be79033f0e55dd4a7af4064acad2a44ae569e0fab74b","media":[],"packId":"wp_c342858c2e11f9c4d82a1853f76117b2b092e6a57b706a59eb3355684098f4f5","quality":"core","routeId":"15573295095","schemaVersion":1,"selectedMoments":[],"worldId":"banff-mountain"}
